{
  "registration_id": "DREG-24627a7672298baf20696d7897a009b6fb6b8ed37f0f708b2bae2ff452c882d8",
  "registration_hash": "sha256:24627a7672298baf20696d7897a009b6fb6b8ed37f0f708b2bae2ff452c882d8",
  "source_blob_artifact_id": "ART-SOURCE-BLOB-0001",
  "source_artifact_receipt_id": "AR-SOURCE-BLOB-0001",
  "registration_artifact_receipt_id": "AR-DOCUMENT-REGISTRATION-0001",
  "derived_from_registration_id": "DREG-24627a7672298baf20696d7897a009b6fb6b8ed37f0f708b2bae2ff452c882d8",
  "supersedes_document_manifest_id": null,
  "lineage_event_ids": [
    "EV-DOCUMENT-REGISTERED-0001",
    "EV-DOCUMENT-MANIFEST-FINALIZED-0001"
  ],
  "document_id": "DOC-0001",
  "paper_id": "P-0001",
  "paper_version_id": "PV-0001",
  "content_hash": "sha256:2b206282ed63918b53329dc711379db52d99d4fff7d7689a724dc1d638678495",
  "original_filename": "fixture.txt",
  "media_type": "text/plain",
  "source_uri": "https://example.org/fixture.txt",
  "doi": null,
  "bibliographic_version": "version_of_record",
  "supersedes_version_id": null,
  "status": "active",
  "license_status": "open_access",
  "access_policy_ref": "POL-access-v1",
  "parser_artifact_ids": [
    "ART-TEI-0001",
    "ART-DOCLING-0001"
  ],
  "source_integrity_report_id": "SIR-0001",
  "malware_scan_status": "clean",
  "prompt_injection_scan_status": "clean",
  "ingested_at": "2026-07-25T12:00:00Z",
  "provenance_manifest_id": "PROV-0001"
}
